{"experiment": 1, "date": "2026-08-21", "hypothesis": "Disabling the too-short lengthening pass removes extreme compression without reducing coverage of source articulation", "variable": "DUB_LENGTHEN_SHORT_TAKES 1 -> 0", "baseline_bundle": "20260821-140505-core-v0", "candidate_bundle": "20260821-142611-core-v0", "noise_reference": ["20260821-022651-core-v0", "20260821-140505-core-v0"], "expected": {"stretch_p90": "39 -> <10", "padding_ms": "up modestly", "coverage_articulation": "unchanged +-0.05", "judge_adequacy": "unchanged"}, "actual": {"stretch_mean": "9.9 -> 1.3", "stretch_p90": "46.2 -> 0.0", "stretch_max": "92 -> 25", "word_similarity": "0.894 -> 0.978", "speaker_similarity": "+0.010", "judge_adequacy": "-0.005", "padding_ms": "1080 -> 2022", "coverage_articulation": "0.66 -> 0.59 (French 0.56 -> 0.38; noise floor 0.10)", "mouth_motion_on_silence_s": "2.1 -> 2.8 (French +1.9)", "delta_lse_c_vs_source": "+0.39 -> +0.47", "wall_seconds": "1680 -> 1512"}, "decision": "keep", "rationale": "Dominates on compression, intelligibility and sync at no translation cost; coverage delta within the measured noise floor. The lengthening pass was masking the placement problem (shorter target speech has no placement policy), which experiment 2 targets.", "config_after": {"dub_lengthen_short_takes": false}}
{"experiment": 2, "date": "2026-08-21", "hypothesis": "Placing take phrases on the source's speech runs raises coverage of articulation and lowers mouth-motion-on-silence", "variable": "DUB_PLACE_ON_SOURCE_RUNS 0 -> 1", "baseline_bundle": "20260821-142611-core-v0", "candidate_bundle": "20260821-164352-core-v0", "expected": {"coverage_articulation": "up", "mouth_motion_on_silence_s": "down", "stretch": "unchanged", "word_similarity": "unchanged"}, "actual": {"coverage_articulation": "0.585 -> 0.484", "mouth_motion_on_silence_s": "2.83 -> 3.30", "sync_lse_c": "3.12 -> 2.25", "word_similarity": "0.978 -> 0.898", "speaker_similarity": "-0.024", "judge_adequacy": "-0.005"}, "decision": "revert", "rationale": "All targeted metrics moved the wrong way; greedy placement scattered and truncated phrases. Placement heuristics are not the dominant error; stop this line per the three-track plan.", "config_after": {"dub_place_on_source_runs": false}}
{"experiment": "LIPSYNC-001", "date": "2026-08-21", "hypothesis": "LatentSync 1.6 materially beats MuseTalk 1.5 on identical frames and audio", "variable": "lip model (MuseTalk 1.5 vs LatentSync 1.6), 3 shots of job 77577c114226", "bundle": "lipsync-001", "actual": {"lse_c": "2.02 -> 4.07", "lse_d": "10.19 -> 8.37", "arcface_identity": "0.791 -> 0.953", "aperture_ratio": "0.57 -> 0.80", "lpips_outside_mouth": "0.020 -> 0.050", "jitter_ratio": "1.01 -> 1.21 (fps-inflated ~1.2x; u001 1.62 real)", "mouth_on_silence_s": "1.0 -> 1.2", "runtime_s_per_shot": "93 -> 171", "peak_vram_mb": "9013 -> 17500"}, "decision": "keep (adopt LatentSync 1.6 as lip tier; integrate as selectable engine, then validate with the suite)"}
{"experiment": 3, "date": "2026-08-21", "hypothesis": "Accurate seek + cut-by-duration fixes the first-shot clip over-length (frames began at t=0)", "variable": "lipsync.py clip extraction: -ss X -to Y (input) -> -accurate_seek -ss X -i -t (Y-X)", "baseline_bundle": "20260821-142611-core-v0", "candidate_bundle": "20260821-201653-core-v0", "expected": {"lipsync_clip_length_ratio_err": "0.069 -> ~0", "others": "noise"}, "actual": {"lipsync_clip_length_ratio_err": "0.0691 -> 0.0011 (all shots 1.00)", "coverage_articulation": "+0.04 (noise)", "sync_lse_c": "-0.12 (noise; TTS resampled per run)", "word_similarity": "+0.006", "stretch": "1.3 -> 0"}, "decision": "keep"}
{"experiment": 4, "date": "2026-08-21", "hypothesis": "LatentSync 1.6 gains survive the full pipeline (composite, fps resample, delivery QC)", "variable": "LIPSYNC_ENGINE musetalk -> latentsync", "baseline_bundle": "20260821-201653-core-v0", "candidate_bundle": "20260821-210024-core-v0", "actual": {"sync_lse_c": "3.01 -> 5.19", "sync_lse_d": "10.57 -> 8.70", "aperture_ratio": "0.69 -> 0.82", "speech_on_static_mouth_s": "0.19 -> 0.09", "coverage": "-0.04 (noise)", "mouth_motion_on_silence_s": "+0.16 (noise)", "sync_offset_abs_frames": "0.8 -> 1.8 (resample cost; fix in integration)", "wall": "+5%", "delivery_qc": "pass"}, "decision": "keep", "config_after": {"lipsync_engine": "latentsync"}}
{"id":"EXP-AUDIO-003","variable":"DUB_MUTE_WHOLE_UTTERANCE false->true","clip":"gb-fr 60s offline A/B, identical takes","metric":"source_residual_seconds_above_50db","before":10.8,"after":1.9,"regressions":"none (preserved source outside takes 0.43->0.43)","decision":"keep"}
{"id":"EXP-VIDEO-001","variable":"25->30 fps resample: blend vs hold vs dup on identical frames","clip":"gb-fr exp-4 cues 1-2","metric":"mouth_sharpness_ratio / dup_frame_fraction / lse_c","before":"blend 0.69/0.63, dup 0.12/0.00, LSE-C 3.74/3.26","after":"hold 0.74/0.68, dup 0.24/0.17, LSE-C 3.72/3.01","regressions":"hold: duplicated frames 17-24%, LSE-C lower","decision":"no change; blur originates in the LatentSync render (raw 0.65/0.62)"}
{"id":"EXP-VIDEO-002","variable":"none (decomposition)","clip":"gb-fr exp-4","metric":"render_lag_ms / boundary step","before":"composite lags source by 67-100 ms in every clip; edge steps 6-10x source motion","after":"cause isolated: LatentSync read_video `ffmpeg -r 25` shifts content -47..-73 ms; fps=25 filter exact","regressions":"n/a","decision":"fix as EXP-VIDEO-003"}
{"id":"EXP-VIDEO-003","variable":"LIPSYNC_PRE_RESAMPLE_25 false->true","clip":"core-v0","metric":"composite lag vs source inside lip-sync clips","before":"-2..-3 frames (67-100 ms)","after":"0..-1 frame (<=33 ms)","regressions":"none beyond noise (LSE-C 5.19->5.08 n=6)","decision":"keep"}
{"id":"EXP-VIDEO-004","variable":"LIPSYNC_EXTENT utterance->voiced","clip":"core-v0","metric":"mouth_motion_on_silence_s / speech_on_static_mouth_s","before":"1.62 / 2.13","after":"1.70 / 2.22","regressions":"none beyond noise","decision":"revert (no effect; confounded by short take)"}
{"id":"EXP-SYNC-001","variable":"range extraction: output-side -ss -> input-side -ss (+start guard)","clip":"core-v0","metric":"picture_offset_outside_lipsync_frames","before":121,"after":0,"regressions":"coverage 0.75->0.59 and LSE-C 5.30->4.33 (noise-prone, n<=12); gb-fr cue 3 skipped by active-speaker gate after alignment","decision":"keep; re-baseline core-v1"}
{"id":"ENG-001","variable":"remux: clear default flag on original audio","clip":"offline remux of core-v0 job","metric":"default_audio_streams","before":2,"after":1,"regressions":"none (delivery QC passes)","decision":"keep"}
{"id":"MIX-003","variable":"DUB_MASTERING_MODE dynamic->peak_safe (3 dB limiter allowance)","clip":"offline remaster of 3 core-v1 jobs","metric":"master_dialogue_squash_db","before":"-2.9/+0.1/-2.3","after":"-0.03/+0.37/-0.21","regressions":"programme LUFS -15.6/-16.7/-17.5 -> -16.0/-19.9/-17.2","decision":"keep"}
{"id":"EXP-TIMING-001","variable":"DUB_SELECT_BY_MEASURED_DURATION false->true","clip":"core-v0","metric":"active_fill p10/p50 (gb-fr)","before":"37/62","after":"57/77","regressions":"wall time +8..22%; judge adequacy 0.72->0.69 (noise)","decision":"keep"}
{"id":"EXP-TRANS-001","variable":"TRANSLATION_PER_LINE false->true","clip":"trans-001 (core-v0 + tos-lab)","metric":"judge adequacy==0 count","before":"6 / 3 / 0","after":"0 / 0 / 0","regressions":"none (gb-fr mean 0.87->0.82 within noise)","decision":"keep"}
{"id":"VIDEO-006","variable":"composite: clip start snapped to base frame grid (floor)","clip":"offline re-composite of charade-office + gb jobs","metric":"picture offset inside minus outside (frames)","before":"-1 / -1","after":"0 / 0 (±1 sample noise)","regressions":"none","decision":"keep"}
{"id":"SEP-002","variable":"DUB_ADAPTIVE_BACKGROUND off->on","clip":"offline on tos-lab job","metric":"bed level over recovered cues","before":"-14.0/-16.1/-30.2 dB","after":"-17.1/-17.6/-31.8 dB; elsewhere unchanged","regressions":"none","decision":"keep (small effect)"}
{"id":"EXP-VIDEO-007","variable":"LIPSYNC_FACE_CROP false->true (dominant-track selection + face-crop render)","clip":"core-v0","metric":"lipsync_coverage gb-fr / gb-es","before":"0.24 / 0.41","after":"0.86 / 0.72","regressions":"none (LSE-C 4.8->5.25, sharpness up)","decision":"keep"}
{"id":"EXP-MIX-004","variable":"DUB_LEVEL_MATCH_MAX_DB 12->24","clip":"trans-001","metric":"take level vs source dialogue (tos-lab median)","before":-10.5,"after":-2.1,"regressions":"gb-es master squash -0.65 -> -2.43 dB","decision":"keep"}
{"id":"EXP-TIMING-002","variable":"ADAPTER_LANGUAGE_RATES false->true","clip":"trans-001","metric":"fill p10/p50 (gb-fr / tos-lab)","before":"65/77 / 64/81","after":"73/82 / 50/73","regressions":"tos-lab stretch p90 19.7->27.1; wall x1.5-1.9","decision":"revert"}
{"id":"EXP-TIMING-003","variable":"DUB_MEASURE_ALL_TAKES false->true","clip":"trans-001","metric":"fill p50 gb-fr / stretch p90 tos-lab","before":"77 / 19.7","after":"86 / 0.0","regressions":"wall x1.1-2.1; tos-lab fill p10 64->54","decision":"keep (quality point; flag = compute knob)"}
{"id":"EXP-VIDEO-008","variable":"LATENTSYNC_GUIDANCE_SCALE 1.5->2.5","clip":"core-v0","metric":"LSE-C / articulation","before":"n/a","after":"n/a","regressions":"run invalid (setting absent on server)","decision":"re-run"}
{"id":"EXP-MIX-006","variable":"DUB_MATCH_SOURCE_BALANCE off->on","clip":"trans-001","metric":"bed_ratio_delta_db","before":"n/a","after":"n/a","regressions":"run invalid (setting absent on server)","decision":"re-run"}
{"id":"EXP-VIDEO-008","variable":"LATENTSYNC_GUIDANCE_SCALE 1.5->2.5","clip":"core-v0","metric":"LSE-C mean / aperture_ratio","before":"5.25 / 0.94","after":"5.96 / 1.04","regressions":"mouth_motion_on_silence 1.47->1.65 s","decision":"keep"}
{"id":"EXP-MIX-006","variable":"DUB_MATCH_SOURCE_BALANCE off->on","clip":"trans-001","metric":"bed_ratio_delta_db tos-lab / d2b_snr","before":"-3.33 / -1.77","after":"-1.42 / -0.13","regressions":"gb-es squash 0 -> -1.3 dB","decision":"keep"}
{"id":"TRANS-002","variable":"is_nonverbal_filler catches junk fragments (unconditional)","clip":"corpus scan all core-v1","metric":"invented-content cues (adequacy 0.0)","before":"1-2 per suite run","after":"expected 0 (fragments preserved)","regressions":"none (only the 2 junk fragments matched)","decision":"keep"}
{"id":"EXP-ENTITY-001","variable":"ENTITY_LEXICON false->true","clip":"core-v1","metric":"inconsistent name clusters (suite total)","before":8,"after":3,"regressions":"judge adequacy 0.885->0.879 (noise)","decision":"keep"}
{"id":"EXP-TIMING-004","variable":"DUB_LIPSYNC_SLACK false->true","clip":"core-v1","metric":"stretch mean/p90, padding, QC","before":"5.80 / 8.73 / 434 / 10-of-10 (reference-5)","after":"7.14 / 9.05 / 471 / 10-of-10","regressions":"all deltas inside the measured noise floor","decision":"revert (provisional keep withdrawn after noise-floor audit)"}
